{
  "report_type": "inventory",
  "version": "1.0.0",
  "generated_at_utc": "2026-08-07T12:00:00Z",
  "banner": "SYNTHETIC DEMONSTRATION DATA",
  "synthetic": true,
  "change_label": "PROPOSED / SIMULATED \u2014 NOT APPLIED",
  "summary": {
    "device_count": 10,
    "segments": 6
  },
  "items": [
    {
      "device_id": "SYNTHETIC-FW-01",
      "alias": "Synthetic Firewall",
      "mac": "02:00:00:00:21:01",
      "ipv4": "192.0.2.1",
      "ipv6": "2001:db8::1",
      "hostname": "SYNTHETIC-FW-01",
      "vendor": "Sample Network Hardware",
      "device_class_hint": "firewall",
      "connection_type": "wired",
      "current_segment": "management",
      "recommended_segment": "management",
      "security_state": "approved",
      "online": true,
      "first_seen_utc": "2026-08-07T12:00:00Z",
      "last_seen_utc": "2026-08-07T12:00:00Z",
      "stale": false,
      "tags": [
        "infrastructure"
      ],
      "switch_id": null,
      "port_id": "WAN0",
      "ownership_label": "lab-owned",
      "provenance": "synthetic",
      "source_mode": "synthetic",
      "banner": "SYNTHETIC DEMONSTRATION DATA"
    },
    {
      "device_id": "SYNTHETIC-SW-CORE-01",
      "alias": "Synthetic Core Switch",
      "mac": "02:00:00:00:22:01",
      "ipv4": "192.0.2.2",
      "hostname": "SYNTHETIC-SW-CORE-01",
      "vendor": "Sample Network Hardware",
      "device_class_hint": "switch",
      "connection_type": "wired",
      "current_segment": "infrastructure",
      "recommended_segment": "infrastructure",
      "security_state": "approved",
      "online": true,
      "first_seen_utc": "2026-08-07T12:00:00Z",
      "last_seen_utc": "2026-08-07T12:00:00Z",
      "stale": false,
      "tags": [],
      "provenance": "synthetic",
      "source_mode": "synthetic",
      "banner": "SYNTHETIC DEMONSTRATION DATA"
    },
    {
      "device_id": "SYNTHETIC-AP-01",
      "alias": "Synthetic Access Point 01",
      "mac": "02:00:00:00:24:01",
      "ipv4": "198.51.100.10",
      "hostname": "SYNTHETIC-AP-01",
      "vendor": "Sample Network Hardware",
      "device_class_hint": "access_point",
      "connection_type": "wired",
      "current_segment": "infrastructure",
      "recommended_segment": "infrastructure",
      "security_state": "approved",
      "online": true,
      "first_seen_utc": "2026-08-07T12:00:00Z",
      "last_seen_utc": "2026-08-07T12:00:00Z",
      "stale": false,
      "ssid": "SYNTHETIC-LAB",
      "switch_id": "SYNTHETIC-SW-EDGE-01",
      "port_id": "Gi1/0/10",
      "provenance": "synthetic",
      "source_mode": "synthetic",
      "banner": "SYNTHETIC DEMONSTRATION DATA"
    },
    {
      "device_id": "SYNTHETIC-WS-01",
      "alias": "Trusted Workstation",
      "mac": "02:00:00:00:23:01",
      "ipv4": "203.0.113.20",
      "hostname": "SYNTHETIC-WS-01",
      "vendor": "Synthetic Devices Ltd.",
      "device_class_hint": "workstation",
      "connection_type": "wired",
      "current_segment": "trusted",
      "recommended_segment": "trusted",
      "security_state": "approved",
      "online": true,
      "first_seen_utc": "2026-08-07T12:00:00Z",
      "last_seen_utc": "2026-08-07T12:00:00Z",
      "stale": false,
      "switch_id": "SYNTHETIC-SW-EDGE-01",
      "port_id": "Gi1/0/21",
      "provenance": "synthetic",
      "source_mode": "synthetic",
      "banner": "SYNTHETIC DEMONSTRATION DATA"
    },
    {
      "device_id": "SYNTHETIC-PRN-01",
      "alias": "IoT Printer",
      "mac": "02:00:00:00:24:11",
      "ipv4": "203.0.113.41",
      "hostname": "SYNTHETIC-PRN-01",
      "vendor": "Fictional Print Works",
      "device_class_hint": "printer",
      "connection_type": "wired",
      "current_segment": "iot",
      "recommended_segment": "iot",
      "security_state": "approved",
      "online": true,
      "first_seen_utc": "2026-08-07T12:00:00Z",
      "last_seen_utc": "2026-08-07T12:00:00Z",
      "stale": false,
      "tags": [
        "printing"
      ],
      "provenance": "synthetic",
      "source_mode": "synthetic",
      "banner": "SYNTHETIC DEMONSTRATION DATA"
    },
    {
      "device_id": "SYNTHETIC-PHONE-GUEST-01",
      "alias": "Guest Smartphone",
      "mac": "02:00:00:00:25:01",
      "ipv4": "198.51.100.80",
      "hostname": "SYNTHETIC-PHONE-GUEST-01",
      "vendor": "Synthetic Devices Ltd.",
      "device_class_hint": "smartphone",
      "connection_type": "wireless",
      "current_segment": "guest",
      "recommended_segment": "guest",
      "security_state": "restricted",
      "online": true,
      "first_seen_utc": "2026-08-07T12:00:00Z",
      "last_seen_utc": "2026-08-07T12:00:00Z",
      "stale": false,
      "tags": [
        "guest_ssid"
      ],
      "ssid": "SYNTHETIC-GUEST",
      "ap_id": "SYNTHETIC-AP-02",
      "signal_bucket": "good",
      "rssi": -62,
      "provenance": "synthetic",
      "source_mode": "synthetic",
      "banner": "SYNTHETIC DEMONSTRATION DATA"
    },
    {
      "device_id": "SYNTHETIC-UNK-01",
      "alias": "Unknown Quarantined Device",
      "mac": "02:00:00:00:26:01",
      "ipv4": "192.0.2.200",
      "hostname": "SYNTHETIC-UNK-01",
      "vendor": null,
      "device_class_hint": "unknown",
      "connection_type": "wireless",
      "current_segment": "quarantine",
      "recommended_segment": "quarantine",
      "security_state": "quarantined",
      "online": true,
      "first_seen_utc": "2026-08-07T12:00:00Z",
      "last_seen_utc": "2026-08-07T12:00:00Z",
      "stale": false,
      "ssid": "SYNTHETIC-LAB",
      "ap_id": "SYNTHETIC-AP-01",
      "signal_bucket": "weak",
      "rssi": -82,
      "provenance": "synthetic",
      "source_mode": "synthetic",
      "banner": "SYNTHETIC DEMONSTRATION DATA"
    },
    {
      "device_id": "SYNTHETIC-CAM-01",
      "alias": "IoT Camera",
      "mac": "02:00:00:00:27:01",
      "ipv4": "203.0.113.55",
      "hostname": "SYNTHETIC-CAM-01",
      "vendor": "Demo IoT Corporation",
      "device_class_hint": "camera",
      "connection_type": "wired",
      "current_segment": "iot",
      "recommended_segment": "iot",
      "security_state": "approved",
      "online": true,
      "first_seen_utc": "2026-08-07T12:00:00Z",
      "last_seen_utc": "2026-08-07T12:00:00Z",
      "stale": false,
      "provenance": "synthetic",
      "source_mode": "synthetic",
      "banner": "SYNTHETIC DEMONSTRATION DATA"
    },
    {
      "device_id": "SYNTHETIC-SRV-01",
      "alias": "Infrastructure Server",
      "mac": "02:00:00:00:28:01",
      "ipv4": "198.51.100.20",
      "hostname": "SYNTHETIC-SRV-01",
      "vendor": "Example Systems Inc.",
      "device_class_hint": "server",
      "connection_type": "wired",
      "current_segment": "infrastructure",
      "recommended_segment": "infrastructure",
      "security_state": "awaiting_approval",
      "online": true,
      "first_seen_utc": "2026-08-07T12:00:00Z",
      "last_seen_utc": "2026-08-07T12:00:00Z",
      "stale": false,
      "tags": [
        "requires_approval"
      ],
      "provenance": "synthetic",
      "source_mode": "synthetic",
      "banner": "SYNTHETIC DEMONSTRATION DATA"
    },
    {
      "device_id": "SYNTHETIC-LAP-MISPLACED-01",
      "alias": "Misplaced Laptop",
      "mac": "02:00:00:00:29:01",
      "ipv4": "203.0.113.99",
      "hostname": "SYNTHETIC-LAP-MISPLACED-01",
      "vendor": "Synthetic Devices Ltd.",
      "device_class_hint": "laptop",
      "connection_type": "wireless",
      "current_segment": "trusted",
      "recommended_segment": "iot",
      "security_state": "policy_violation",
      "online": true,
      "first_seen_utc": "2026-08-07T12:00:00Z",
      "last_seen_utc": "2026-08-07T12:00:00Z",
      "stale": false,
      "ssid": "SYNTHETIC-IOT",
      "ap_id": "SYNTHETIC-AP-03",
      "signal_bucket": "moderate",
      "rssi": -71,
      "tags": [
        "drift_example"
      ],
      "provenance": "synthetic",
      "source_mode": "synthetic",
      "banner": "SYNTHETIC DEMONSTRATION DATA"
    }
  ],
  "limitations": [
    "Documentation IP ranges only.",
    "Locally administered MAC addresses (02:).",
    "No real network data."
  ]
}
